{
  "abstention_policy": "fail_closed",
  "dsl_version": "1.1",
  "eligibility": {
    "all": []
  },
  "fact_gate": {
    "on_missing_critical": {
      "common_stance": "out_of_scope",
      "native_state": "provisional_document_gap"
    }
  },
  "hard_vetoes": [],
  "native_decision_schema": "structural_mispricing_v1",
  "native_output_fields": [
    {
      "field": "metric_1",
      "on_missing": "fail",
      "value": {
        "output_id": "capital_structure.seniority"
      }
    },
    {
      "field": "metric_2",
      "on_missing": "fail",
      "value": {
        "output_id": "mispricing.mechanism"
      }
    }
  ],
  "native_states": [
    "provisional_document_gap",
    "provisional_opinion_only",
    "provisional_watch",
    "provisional_structural_mispricing"
  ],
  "schema_version": 1,
  "score_bands": [
    {
      "decision": {
        "common_stance": "opposed",
        "native_state": "provisional_opinion_only"
      },
      "min_ratio": 0
    },
    {
      "decision": {
        "common_stance": "cautious",
        "native_state": "provisional_watch"
      },
      "min_ratio": 0.5
    },
    {
      "decision": {
        "common_stance": "cautious",
        "native_state": "provisional_structural_mispricing"
      },
      "min_ratio": 1
    }
  ],
  "scoring": {
    "max_score": 2,
    "min_coverage": 1,
    "on_insufficient_coverage": {
      "common_stance": "out_of_scope",
      "native_state": "provisional_document_gap"
    },
    "rules": [
      {
        "condition": {
          "left": {
            "output_id": "capital_structure.seniority"
          },
          "op": "gt",
          "right": {
            "literal": 0
          }
        },
        "coverage_weight": 1,
        "points": 1,
        "rule_id": "proxy_score_1",
        "source_ids": [
          "proxy:671173c81294794a1"
        ]
      },
      {
        "condition": {
          "left": {
            "output_id": "mispricing.mechanism"
          },
          "op": "gt",
          "right": {
            "literal": 0
          }
        },
        "coverage_weight": 1,
        "points": 1,
        "rule_id": "proxy_score_2",
        "source_ids": [
          "proxy:671173c81294794a1"
        ]
      }
    ]
  }
}
