{
  "abstention_policy": "fail_closed",
  "dsl_version": "1.1",
  "eligibility": {
    "all": [
      {
        "condition": {
          "op": "exists",
          "value": {
            "fact_id": "index.aggregate_pe_ttm"
          }
        },
        "condition_id": "master_marks.market_valuation_observable",
        "on_false": {
          "common_stance": "out_of_scope",
          "native_state": "provisional_cycle_unknown"
        },
        "on_uncomputable": {
          "common_stance": "out_of_scope",
          "native_state": "provisional_cycle_unknown"
        },
        "source_ids": [
          "proxy:08cfa8347347faed7"
        ]
      }
    ]
  },
  "fact_gate": {
    "on_missing_critical": {
      "common_stance": "out_of_scope",
      "native_state": "provisional_cycle_unknown"
    }
  },
  "hard_vetoes": [
    {
      "condition": {
        "conditions": [
          {
            "left": {
              "output_id": "macro.credit_spread_gap.master_marks"
            },
            "op": "lt",
            "right": {
              "literal": 0
            }
          },
          {
            "left": {
              "fact_id": "index.aggregate_earnings_yield"
            },
            "op": "lt",
            "right": {
              "fact_id": "macro.aaa_corporate_yield"
            }
          }
        ],
        "op": "all"
      },
      "on_trigger": {
        "common_stance": "opposed",
        "native_state": "provisional_defensive"
      },
      "on_uncomputable": {
        "action": "abstain",
        "decision": {
          "common_stance": "out_of_scope",
          "native_state": "provisional_cycle_unknown"
        }
      },
      "source_ids": [
        "proxy:08cfa8347347faed7"
      ],
      "veto_id": "master_marks.euphoria"
    }
  ],
  "native_decision_schema": "cycle_risk_posture_v1",
  "native_output_fields": [
    {
      "field": "metric_1",
      "on_missing": "fail",
      "value": {
        "output_id": "macro.credit_spread_gap.master_marks"
      }
    },
    {
      "field": "metric_2",
      "on_missing": "fail",
      "value": {
        "output_id": "index.equity_over_corporate_debt_premium.master_marks"
      }
    }
  ],
  "native_states": [
    "provisional_cycle_unknown",
    "provisional_defensive",
    "provisional_balanced",
    "provisional_aggressive"
  ],
  "schema_version": 1,
  "score_bands": [
    {
      "decision": {
        "common_stance": "opposed",
        "native_state": "provisional_defensive"
      },
      "min_ratio": 0
    },
    {
      "decision": {
        "common_stance": "cautious",
        "native_state": "provisional_balanced"
      },
      "min_ratio": 0.5
    },
    {
      "decision": {
        "common_stance": "constructive",
        "native_state": "provisional_aggressive"
      },
      "min_ratio": 1
    }
  ],
  "scoring": {
    "max_score": 2,
    "min_coverage": 1,
    "on_insufficient_coverage": {
      "common_stance": "out_of_scope",
      "native_state": "provisional_cycle_unknown"
    },
    "rules": [
      {
        "condition": {
          "left": {
            "output_id": "macro.credit_spread_gap.master_marks"
          },
          "op": "gt",
          "right": {
            "literal": 0
          }
        },
        "coverage_weight": 1,
        "points": 1,
        "rule_id": "marks_credit_spread_above_long_run_average",
        "source_ids": [
          "proxy:08cfa8347347faed7"
        ]
      },
      {
        "condition": {
          "left": {
            "output_id": "index.equity_over_corporate_debt_premium.master_marks"
          },
          "op": "gt",
          "right": {
            "literal": 0
          }
        },
        "coverage_weight": 1,
        "points": 1,
        "rule_id": "marks_equity_paid_over_corporate_debt",
        "source_ids": [
          "proxy:08cfa8347347faed7"
        ]
      }
    ]
  }
}
