{
  "abstention_policy": "fail_closed",
  "dsl_version": "1.1",
  "eligibility": {
    "all": [
      {
        "condition": {
          "op": "exists",
          "value": {
            "fact_id": "financial.leverage"
          }
        },
        "condition_id": "master_thorp.ruin_constraint_evaluable",
        "on_false": {
          "common_stance": "out_of_scope",
          "native_state": "provisional_out_of_scope"
        },
        "on_uncomputable": {
          "common_stance": "out_of_scope",
          "native_state": "provisional_out_of_scope"
        },
        "source_ids": [
          "proxy:1366952123de20fc8"
        ]
      }
    ]
  },
  "fact_gate": {
    "on_missing_critical": {
      "common_stance": "out_of_scope",
      "native_state": "provisional_out_of_scope"
    }
  },
  "hard_vetoes": [
    {
      "condition": {
        "left": {
          "output_id": "trade.net_edge.master_thorp"
        },
        "op": "lte",
        "right": {
          "fact_id": "execution.bid_ask"
        }
      },
      "on_trigger": {
        "common_stance": "opposed",
        "native_state": "provisional_no_measurable_edge"
      },
      "on_uncomputable": {
        "action": "abstain",
        "decision": {
          "common_stance": "out_of_scope",
          "native_state": "provisional_out_of_scope"
        }
      },
      "source_ids": [
        "proxy:1366952123de20fc8"
      ],
      "veto_id": "master_thorp.edge_inside_the_friction"
    }
  ],
  "native_decision_schema": "edge_sizing_v1",
  "native_output_fields": [
    {
      "field": "metric_1",
      "on_missing": "fail",
      "value": {
        "output_id": "trade.net_edge.master_thorp"
      }
    },
    {
      "field": "metric_2",
      "on_missing": "fail",
      "value": {
        "output_id": "trade.edge_per_unit_of_volatility.master_thorp"
      }
    }
  ],
  "native_states": [
    "provisional_no_measurable_edge",
    "provisional_positive_edge_no_size",
    "provisional_fractional_position",
    "provisional_out_of_scope"
  ],
  "schema_version": 1,
  "score_bands": [
    {
      "decision": {
        "common_stance": "opposed",
        "native_state": "provisional_no_measurable_edge"
      },
      "min_ratio": 0
    },
    {
      "decision": {
        "common_stance": "cautious",
        "native_state": "provisional_positive_edge_no_size"
      },
      "min_ratio": 0.5
    },
    {
      "decision": {
        "common_stance": "constructive",
        "native_state": "provisional_fractional_position"
      },
      "min_ratio": 1
    }
  ],
  "scoring": {
    "max_score": 2,
    "min_coverage": 1,
    "on_insufficient_coverage": {
      "common_stance": "out_of_scope",
      "native_state": "provisional_out_of_scope"
    },
    "rules": [
      {
        "condition": {
          "left": {
            "output_id": "trade.edge_per_unit_of_volatility.master_thorp"
          },
          "op": "gte",
          "right": {
            "literal": 0.063
          }
        },
        "coverage_weight": 1,
        "points": 1,
        "rule_id": "thorp_edge_beyond_one_session_sigma",
        "source_ids": [
          "proxy:1366952123de20fc8"
        ]
      },
      {
        "condition": {
          "left": {
            "fact_id": "financial.leverage"
          },
          "op": "lte",
          "right": {
            "literal": 1
          }
        },
        "coverage_weight": 1,
        "points": 1,
        "rule_id": "thorp_loss_cannot_exceed_the_stake",
        "source_ids": [
          "proxy:1366952123de20fc8"
        ]
      }
    ]
  }
}
