{
  "abstention_policy": "fail_closed",
  "dsl_version": "1.1",
  "eligibility": {
    "all": [
      {
        "condition": {
          "op": "exists",
          "value": {
            "fact_id": "financial.incremental_return_on_capital"
          }
        },
        "condition_id": "master_munger.economics_can_be_stated",
        "on_false": {
          "common_stance": "out_of_scope",
          "native_state": "provisional_out_of_scope"
        },
        "on_uncomputable": {
          "common_stance": "out_of_scope",
          "native_state": "provisional_out_of_scope"
        },
        "source_ids": [
          "proxy:d4d52af8b246f7129"
        ]
      },
      {
        "condition": {
          "op": "exists",
          "value": {
            "fact_id": "financial.leverage"
          }
        },
        "condition_id": "master_munger.capital_structure_readable",
        "on_false": {
          "common_stance": "out_of_scope",
          "native_state": "provisional_out_of_scope"
        },
        "on_uncomputable": {
          "common_stance": "out_of_scope",
          "native_state": "provisional_out_of_scope"
        },
        "source_ids": [
          "proxy:d4d52af8b246f7129"
        ]
      }
    ]
  },
  "fact_gate": {
    "on_missing_critical": {
      "common_stance": "out_of_scope",
      "native_state": "provisional_out_of_scope"
    }
  },
  "hard_vetoes": [
    {
      "condition": {
        "conditions": [
          {
            "left": {
              "fact_id": "financial.leverage"
            },
            "op": "gt",
            "right": {
              "literal": 1
            }
          },
          {
            "left": {
              "output_id": "risk.debt_service_cushion.master_munger"
            },
            "op": "lt",
            "right": {
              "literal": 2
            }
          }
        ],
        "op": "all"
      },
      "on_trigger": {
        "common_stance": "opposed",
        "native_state": "provisional_fatal_path"
      },
      "on_uncomputable": {
        "action": "abstain",
        "decision": {
          "common_stance": "out_of_scope",
          "native_state": "provisional_out_of_scope"
        }
      },
      "source_ids": [
        "proxy:d4d52af8b246f7129"
      ],
      "veto_id": "master_munger.coupled_debt_failure"
    },
    {
      "condition": {
        "left": {
          "output_id": "accounting.reported_earnings_cash_gap.master_munger"
        },
        "op": "lt",
        "right": {
          "literal": -0.5
        }
      },
      "on_trigger": {
        "common_stance": "opposed",
        "native_state": "provisional_fatal_path"
      },
      "on_uncomputable": {
        "action": "abstain",
        "decision": {
          "common_stance": "out_of_scope",
          "native_state": "provisional_out_of_scope"
        }
      },
      "source_ids": [
        "proxy:d4d52af8b246f7129"
      ],
      "veto_id": "master_munger.reported_earnings_are_not_cash"
    }
  ],
  "native_decision_schema": "failure_path_verdict_v1",
  "native_output_fields": [
    {
      "field": "metric_1",
      "on_missing": "fail",
      "value": {
        "output_id": "accounting.reported_earnings_cash_gap.master_munger"
      }
    },
    {
      "field": "metric_2",
      "on_missing": "fail",
      "value": {
        "output_id": "risk.debt_service_cushion.master_munger"
      }
    }
  ],
  "native_states": [
    "provisional_out_of_scope",
    "provisional_fatal_path",
    "provisional_monitor",
    "provisional_no_fatal_path_found"
  ],
  "schema_version": 1,
  "score_bands": [
    {
      "decision": {
        "common_stance": "opposed",
        "native_state": "provisional_fatal_path"
      },
      "min_ratio": 0
    },
    {
      "decision": {
        "common_stance": "cautious",
        "native_state": "provisional_monitor"
      },
      "min_ratio": 0.5
    },
    {
      "decision": {
        "common_stance": "constructive",
        "native_state": "provisional_no_fatal_path_found"
      },
      "min_ratio": 1
    }
  ],
  "scoring": {
    "max_score": 3,
    "min_coverage": 1,
    "on_insufficient_coverage": {
      "common_stance": "out_of_scope",
      "native_state": "provisional_out_of_scope"
    },
    "rules": [
      {
        "condition": {
          "left": {
            "output_id": "accounting.reported_earnings_cash_gap.master_munger"
          },
          "op": "gte",
          "right": {
            "literal": 0
          }
        },
        "coverage_weight": 1,
        "points": 1,
        "rule_id": "munger_earnings_arrive_as_cash",
        "source_ids": [
          "proxy:d4d52af8b246f7129"
        ]
      },
      {
        "condition": {
          "left": {
            "output_id": "risk.debt_service_cushion.master_munger"
          },
          "op": "gte",
          "right": {
            "literal": 4
          }
        },
        "coverage_weight": 1,
        "points": 1,
        "rule_id": "munger_debt_service_has_a_cushion",
        "source_ids": [
          "proxy:d4d52af8b246f7129"
        ]
      },
      {
        "condition": {
          "left": {
            "fact_id": "financial.leverage"
          },
          "op": "lte",
          "right": {
            "literal": 1
          }
        },
        "coverage_weight": 1,
        "points": 1,
        "rule_id": "munger_no_leverage_dependency",
        "source_ids": [
          "proxy:d4d52af8b246f7129"
        ]
      }
    ]
  }
}
