{
  "abstention_policy": "fail_closed",
  "dsl_version": "1.1",
  "eligibility": {
    "all": []
  },
  "fact_gate": {
    "on_missing_critical": {
      "common_stance": "out_of_scope",
      "native_state": "provisional_story_invalid"
    }
  },
  "hard_vetoes": [],
  "native_decision_schema": "category_story_decision_v1",
  "native_output_fields": [
    {
      "field": "metric_1",
      "on_missing": "fail",
      "value": {
        "output_id": "company.category"
      }
    },
    {
      "field": "metric_2",
      "on_missing": "fail",
      "value": {
        "output_id": "business.two_minute_story"
      }
    }
  ],
  "native_states": [
    "provisional_story_invalid",
    "provisional_category_mismatch",
    "provisional_watch",
    "provisional_category_opportunity"
  ],
  "schema_version": 1,
  "score_bands": [
    {
      "decision": {
        "common_stance": "cautious",
        "native_state": "provisional_category_mismatch"
      },
      "min_ratio": 0
    },
    {
      "decision": {
        "common_stance": "cautious",
        "native_state": "provisional_watch"
      },
      "min_ratio": 0.5
    },
    {
      "decision": {
        "common_stance": "cautious",
        "native_state": "provisional_category_opportunity"
      },
      "min_ratio": 1
    }
  ],
  "scoring": {
    "max_score": 2,
    "min_coverage": 1,
    "on_insufficient_coverage": {
      "common_stance": "out_of_scope",
      "native_state": "provisional_story_invalid"
    },
    "rules": [
      {
        "condition": {
          "left": {
            "output_id": "company.category"
          },
          "op": "gt",
          "right": {
            "literal": 0
          }
        },
        "coverage_weight": 1,
        "points": 1,
        "rule_id": "proxy_score_1",
        "source_ids": [
          "proxy:68711236c84ce159a"
        ]
      },
      {
        "condition": {
          "left": {
            "output_id": "business.two_minute_story"
          },
          "op": "gt",
          "right": {
            "literal": 0
          }
        },
        "coverage_weight": 1,
        "points": 1,
        "rule_id": "proxy_score_2",
        "source_ids": [
          "proxy:68711236c84ce159a"
        ]
      }
    ]
  }
}
